<?xml version="1.0" encoding="ISO-8859-1" ?>
<actions xmlVersion="1" xmlns:xsi="http://www.w3.org/2001/XMLSchema-instance" xsi:noNamespaceSchemaLocation="../schemas/action.xsd">

<!-- 

Copyright (C) 2016 - Gareth Edwards / Rapid Information Systems

gareth.edwards@rapid-is.co.uk


This file is part of the Rapid Application Platform

Rapid is free software: you can redistribute it and/or modify
it under the terms of the GNU General Public License as published by
the Free Software Foundation, either version 3 of the License, or
(at your option) any later version. The terms require you to include
the original copyright, and the license notice in all redistributions.

This program is distributed in the hope that it will be useful,
but WITHOUT ANY WARRANTY; without even the implied warranty of
MERCHANTABILITY or FITNESS FOR A PARTICULAR PURPOSE.  See the
GNU General Public License for more details.

You should have received a copy of the GNU General Public License
in a file named "COPYING".  If not, see <http://www.gnu.org/licenses/>.

 -->

    <action>
    
        <type>webservice</type>
        <name>Webservice</name>
	    <class>com.rapid.actions.Webservice</class>
	    <helpHtml>Used for computer to computer communication, the webservice action allows you to set the request type to SOAP, restful XML or JSON. SOAP follows a strict set of rules which must be met in order for a request to go through, restful XML is less strict, and JSON has no set of rules but will block the request if it is unsuccessful..</helpHtml>
	    
	    <addToNewApplications>true</addToNewApplications>
	    
	    <properties>
	        
	        <property>
	            <key>request</key>
	            <name>Request</name>
	            <changeValueJavaScript>webserviceRequest</changeValueJavaScript>
	            <helpHtml>Enables you to define a webservice request. The request can be entered within the text area and can be of the type SOAP, JSON or XML/Restful. Selected inputs and outputs can be chosen for the request.</helpHtml>
	        </property>
	         
	        <property>
	            <key>showLoading</key>
	            <name>Loading animation</name>
	            <changeValueJavaScript>checkbox</changeValueJavaScript>
	            <helpHtml>Sets whether to display a loading animation or not whilst the request is taking place.</helpHtml>
	        </property>
	        
	        <property>
	            <key>successActions</key>
	            <name>Success actions</name>
	            <changeValueJavaScript>childActions</changeValueJavaScript>
	            <helpHtml>Sets actions to be carried out for when the webservice has completed successfully.</helpHtml>
	        </property>
	        
	        <property>
	            <key>errorActions</key>
	            <name>Error actions</name>
	            <changeValueJavaScript>childActions</changeValueJavaScript>
	            <helpHtml>Sets actions to be carried out for when the webservice has not been successful.</helpHtml>
	        </property>
	            
	    </properties>
	    
	    <resources>
	        <resource>
	    		<type>file</type>
	    		<contents>images/wait_120x15.gif</contents>
	    	</resource>
	    	<resource>
	    		<type>javascript</type>
	    		<contents>
	    			<![CDATA[
// this global associative array tracks the webserviceAction call sequences for each action	    			
var _webserviceActionSequence = [];	    

// this global associative array holds the greates sequence received back     			
var _webserviceActionMaxSequence = [];	

// this function returns an incrementing sequence for each database action call so long-running slow queries don't overrwrite fast later queries
function getWebserviceActionSequence(actionId) {
	// retrieve the current sequence for the action
	var sequence = _webserviceActionSequence[actionId];
	// if null set to 0
	if (!sequence) sequence = 0
	// increment
	sequence++;
	// store
	_webserviceActionSequence[actionId] = sequence;
	// pass back
	return sequence;
}	

// this function sets the max to 0 if null
function getWebserviceActionMaxSequence(actionId) {
	// retrieve the current sequence for the action
	var sequence = _webserviceActionMaxSequence[actionId];
	// if undefined
	if (sequence === undefined) {
		// set to 0
		sequence = 0;
		// retain for next time
		_webserviceActionMaxSequence[actionId] = sequence;
	}
	// pass back
	return sequence;
}			
	    			]]>
	    		</contents>
	    	</resource>
	    </resources>
	    	 
	    <actionJavaScript>
	        <![CDATA[ 
function Action_webservice(ev, actionId, data, outputs) {
	// only if there are data and outputs
	if (data && outputs) {
		// only if this is the latest sequence
		if (data.sequence > getWebserviceActionMaxSequence(actionId)) {
			// retain this as the lastest sequence
			_webserviceActionMaxSequence[actionId] = data.sequence;
			// loop the outputs
			for (var i in outputs) {
				var output = outputs[i];			
				window["setData_" + output.type](ev, output.id, output.field, output.details, data);
			}
		}
	}
}	        ]]>
	    </actionJavaScript>   
	    
    </action> 
</actions>