<?xml version="1.0" encoding="ISO-8859-1" ?>
<actions xmlVersion="1" xmlns:xsi="http://www.w3.org/2001/XMLSchema-instance" xsi:noNamespaceSchemaLocation="../schemas/action.xsd">

<!-- 

Copyright (C) 2016 - Gareth Edwards / Rapid Information Systems

gareth.edwards@rapid-is.co.uk


This file is part of the Rapid Application Platform

Rapid is free software: you can redistribute it and/or modify
it under the terms of the GNU General Public License as published by
the Free Software Foundation, either version 3 of the License, or
(at your option) any later version. The terms require you to include
the original copyright, and the license notice in all redistributions.

This program is distributed in the hope that it will be useful,
but WITHOUT ANY WARRANTY; without even the implied warranty of
MERCHANTABILITY or FITNESS FOR A PARTICULAR PURPOSE.  See the
GNU General Public License for more details.

You should have received a copy of the GNU General Public License
in a file named "COPYING".  If not, see <http://www.gnu.org/licenses/>.

 -->

    <action>
    
        <type>existing</type>
        <name>Existing</name>
	    <class>com.rapid.actions.Existing</class>
	    <helpHtml>Enables you to call an existing event on that specific page. If the event being referenced here is removed then it will display as a blank event, meaning you are free to delete or change the event target as the previous one is no longer present.</helpHtml>
	    
	    <addToNewApplications>true</addToNewApplications>

		<properties>
	        <property>
	            <key>action</key>
	            <name>Action</name>
	            <changeValueJavaScript>select</changeValueJavaScript>
	            <getValuesFunction>
	                <![CDATA[
return "<option value=''>None</option>" + getExistingActionOptions(this.action, this.id);
	                ]]>
	            </getValuesFunction>
	            <helpHtml>Allows the reuse of other, existing actions on other controls, including the page.</helpHtml>
	        </property>
	    </properties>
  
    </action>
</actions>