<?xml version="1.0" encoding="ISO-8859-1" ?>
<actions xmlVersion="1" xmlns:xsi="http://www.w3.org/2001/XMLSchema-instance" xsi:noNamespaceSchemaLocation="../schemas/action.xsd">
 
 <!-- 

Copyright (C) 2016 - Gareth Edwards / Rapid Information Systems

gareth.edwards@rapid-is.co.uk


This file is part of the Rapid Application Platform

Rapid is free software: you can redistribute it and/or modify
it under the terms of the GNU General Public License as published by
the Free Software Foundation, either version 3 of the License, or
(at your option) any later version. The terms require you to include
the original copyright, and the license notice in all redistributions.

This program is distributed in the hope that it will be useful,
but WITHOUT ANY WARRANTY; without even the implied warranty of
MERCHANTABILITY or FITNESS FOR A PARTICULAR PURPOSE.  See the
GNU General Public License for more details.

You should have received a copy of the GNU General Public License
in a file named "COPYING".  If not, see <http://www.gnu.org/licenses/>.

 -->
 
    <action>
    
        <type>timer</type>
        <name>Timer</name>
	    <class>com.rapid.actions.Timer</class>
	    <helpHtml>This action adds a delay to other actions, making them occur after a pre-determined period of time, defaulting to 1 second. This can also be set to repeat. This can be useful for making users wait whilst a back-end change takes place.</helpHtml>
	    
	    <properties>
	        
	        <property>
	            <key>duration</key>
	            <name>Duration (milliseconds)</name>
	            <setConstructValueFunction>return 1000;</setConstructValueFunction>
	            <changeValueJavaScript>integer</changeValueJavaScript>
	            <helpHtml>Sets how long the timer will last.</helpHtml>
	        </property>
	            	
	    	<property>
	            <key>repeat</key>
	            <name>Repeat</name>
	            <setConstructValueFunction>return false;</setConstructValueFunction>
	            <changeValueJavaScript>checkbox</changeValueJavaScript>
	            <helpHtml>Allows you to define whether to repeat the timer action after the ellapsed time has passed.</helpHtml>
	        </property>
	        
	        <property>
	            <key>actions</key>
	            <name>Actions</name>
	            <changeValueJavaScript>childActions</changeValueJavaScript>
	            <helpHtml>Defines the actions to be carried out after the set duration of time has ellapsed.</helpHtml>
	        </property>
	        
	    </properties>
	        	      	    
    </action> 
    
</actions>