<?xml version="1.0" encoding="UTF-8" ?>
<actions xmlVersion="1" xmlns:xsi="http://www.w3.org/2001/XMLSchema-instance" xsi:noNamespaceSchemaLocation="../schemas/action.xsd">

<!-- 

Copyright (C) 2016 - Gareth Edwards / Rapid Information Systems

gareth.edwards@rapid-is.co.uk


This file is part of the Rapid Application Platform

Rapid is free software: you can redistribute it and/or modify
it under the terms of the GNU General Public License as published by
the Free Software Foundation, either version 3 of the License, or
(at your option) any later version. The terms require you to include
the original copyright, and the license notice in all redistributions.

This program is distributed in the hope that it will be useful,
but WITHOUT ANY WARRANTY; without even the implied warranty of
MERCHANTABILITY or FITNESS FOR A PARTICULAR PURPOSE.  See the
GNU General Public License for more details.

You should have received a copy of the GNU General Public License
in a file named "COPYING".  If not, see <http://www.gnu.org/licenses/>.

 -->

    <action>
    
        <type>logic</type>
        <name>Logic</name>
	    <class>com.rapid.actions.Logic</class>
	    <helpHtml>This action allows you to contest certain outcomes and have different success or fail actions occur as a result. Multiple success and failure actions can be stacked inside one another and a variety of different conditions can be tested against, making this action a very powerful and flexible tool to use in a variety of different ways, such as only displaying a page if visibility rules are met.</helpHtml>
	    
	    <addToNewApplications>true</addToNewApplications>
	    	    	    	    
	    <properties>
	        
	         <property>
	            <key>conditions</key>
	            <name>Conditions</name>
	            <changeValueJavaScript>logicConditions</changeValueJavaScript>
	            <refreshProperties>true</refreshProperties>
	            <helpHtml>Sets the conditions for the logic to be carried out. This can be particularly useful for setting controls to appear on the page, or checking for correct details on the page.</helpHtml>
	        </property>
	        
	        <property>
	            <key>conditionsType</key>
	            <name>Type</name>
	            <visible>false</visible>
	            <setConstructValueFunction>return "and";</setConstructValueFunction>
	            <changeValueJavaScript>text</changeValueJavaScript>
	        </property>
	        
	        <property>
	            <key>trueActions</key>
	            <name>Actions if true</name>
	            <changeValueJavaScript>childActions</changeValueJavaScript>
	            <helpHtml>Defines the actions to be carried out if the above condition is true.</helpHtml>
	        </property>
	        
	        <property>
	            <key>falseActions</key>
	            <name>Actions if false</name>
	            <changeValueJavaScript>childActions</changeValueJavaScript>
	            <helpHtml>Defines the actions to be carried out if the above condition is false.</helpHtml>
	        </property>
	            
	    </properties>
	    	   	    	    	    	    	     	     	    
    </action>
</actions>