<?xml version="1.0" encoding="ISO-8859-1" ?>
<actions xmlVersion="1" xmlns:xsi="http://www.w3.org/2001/XMLSchema-instance" xsi:noNamespaceSchemaLocation="../schemas/action.xsd">
 
 <!-- 

Copyright (C) 2014 - Gareth Edwards / Rapid Information Systems

gareth.edwards@rapid-is.co.uk


This file is part of the Rapid Application Platform

RapidSOA is free software: you can redistribute it and/or modify
it under the terms of the GNU General Public License as published by
the Free Software Foundation, either version 3 of the License, or
(at your option) any later version. The terms require you to include
the original copyright, and the license notice in all redistributions.

This program is distributed in the hope that it will be useful,
but WITHOUT ANY WARRANTY; without even the implied warranty of
MERCHANTABILITY or FITNESS FOR A PARTICULAR PURPOSE.  See the
GNU General Public License for more details.

You should have received a copy of the GNU General Public License
in a file named "COPYING".  If not, see <http://www.gnu.org/licenses/>.

 -->
 
    <action>
    
        <type>navigate</type>       
        <name>Navigate</name>	        
	    <class>com.rapid.actions.Navigate</class>	
	    
	    <addToNewApplications>true</addToNewApplications>
	    
	    <properties>
	        
	        <property>
	            <key>page</key>
	            <name>Page</name>
	            <changeValueJavaScript>navigationPage</changeValueJavaScript>	 
	        </property>	
	            	
	    	<property>
	            <key>sessionVariables</key>
	            <name>Page variables</name>
	            <changeValueJavaScript>navigationSessionVariables</changeValueJavaScript>	
	        </property>
	        
	        <property>
	            <key>dialogue</key>
	            <name>Show as dialogue</name>
	            <changeValueJavaScript>checkbox</changeValueJavaScript>	
	            <refreshProperties>true</refreshProperties>
	        </property>
	        
	        <property>
	            <key>stopActions</key>
	            <name>Stop further actions</name>
	            <changeValueJavaScript>navigationStopActions</changeValueJavaScript>
	        </property>
	        
	    </properties>
	    
	    <resources>
	                    <resource>
                <type>css</type>
                <contents>
                    <![CDATA[
                                     
.dialogueCover {
	background-color: white;
	opacity:0.8;
	filter:alpha(opacity=80); 
}

.dialogue {
	background-color: white;
	padding: 0px;
}
                
                    ]]>
                </contents>                
            </resource> 
	    </resources>
	        	    
	    <actionJavaScript>
	        <![CDATA[
	        
//JQuery is ready! 
$(document).ready( function() {
	
	$(window).resize(function(ex) {
	
		var doc = $(document);
		var win = $(window);
				
		// resize the cover
		$(".dialogueCover").css({
       		width : doc.width(),
       		height : doc.height()
       	});
       	      	
       	// resize the dialogues
       	$(".dialogue").each(function() {
       		var dialogue = $(this);
	       	dialogue.css({
	       		left : ((window.innerWidth ? window.innerWidth : win.width()) - dialogue.outerWidth(true)) / 2,
	       		top : ((window.innerHeight ? window.innerHeight : win.height()) - dialogue.outerHeight(true)) / 2
	       	}); 
	    });
	
	});
	
});		        
	        
function Action_navigate(url, dialogue, id) {

	if (dialogue) {
	
		var bodyHtml = "<div><h1 style='margin-left:auto;margin-right:auto;'>Page</h1></div>";
		
		// request the page		
		$.ajax({
		   	url: url,
		   	type: "GET",          
		       data: null,        
		       async: false,
		       error: function(error, status, message) { 
		       		alert("Error loading dialogue : " + error.responseText||message); 
		       },
		       success: function(page) {
		       	
		       // if the page can't be found a blank response is sent, so only show if we got something
		       if (page) {
		       	
		       		// empty the body html
		       		bodyHtml = "";
		       		script = "";
		       		links = "";
		       		
		       		// get the page document head
		       		var head = $("head");
		       		
		           	// loop the items
		           	var items = $(page);
		           	for (var i in items) {
		           		// check for a script node
		           		switch (items[i].nodeName) {
		           		case "#text" : case "TITLE" : // ignore these types
		           		break;
		           		case "SCRIPT" :
		           			// check whether a script block or link
		           			if (items[i].innerHTML) {
		           				var s = items[i].outerHTML;
		           				// exclude the app id, version, page, mobile resume link
		           				if (s.indexOf("var _appId =") == -1 && s.indexOf("var _appVersion =") == -1 && s.indexOf("var _pageId =") == -1 && s.indexOf("var _mobileResume =") == -1)
		           					script += s;
		           			} else {
		           				// fetch the text
		           				var text = items[i].outerHTML;
		           				// look for a src
		           				if (text.indexOf("src=\"") > 0) {
		           					var startPos = text.indexOf("src=\"")+5;
		           					var src = text.substr(startPos,text.indexOf("\"", startPos) - startPos);		           					
		           					// add this to the page if not there already
		           					if (!head.find("script[src='" + src + "']")[0]) head.append(text);
		           				}
		           			}          			
		           		break;
		           		case "LINK" :
		           			// fetch the text
		           			var text = items[i].outerHTML;	           			
		           			// look for an href="
		           			if (!items[i].innerHTML && text.indexOf("href=\"") > 0) {
		           				var startPos = text.indexOf("href=\"")+6;
		           				var href = text.substr(startPos,text.indexOf("\"", startPos) - startPos);
		           				// add this link to the page if not there already
		           				if (!head.find("link[href='" + href + "']")[0]) head.append(text);
		           			}		           				           			
		           		break;
		           		case "META" :
		           			// meta tags can be ignored
		           		break;
		           		default :
		           			if (items[i].outerHTML) {
		           				// retain the script in our body html
		           				bodyHtml += items[i].outerHTML;        				
		           			}
		           		break;
		           		}
		           	}   
		           	
		           	// if this is the login page go to the real thing, requesting to come back to this location
            		if (bodyHtml.indexOf("<form name=\"login\" id=\"RapidLogin\">") > 0) window.location = "login.jsp?requestPath=" + window.location; 
            	
            		// get a reference to the document for the entire height and width     	
		           	var doc = $(document);
		           	// get a reference to the body		           	
		           	var body = $("body");
		           	
		           	// remove any existing dialogue cover for this action
		           	$("#" + id + "cover").remove();
		           	// add the cover and return reference
		           	dialogueCover = body.append("<div id='" + id + "cover' class='dialogueCover' style='position:absolute;left:0px;top:0px;z-index:1000;'></div>").children().last();
		           			      		           			           		            	
	            	// remove any existing dialogue container for this action
		           	$("#" + id + "dialogue").remove();
		           	// add the dialogue container and remove the reference
		           	dialogue = body.append("<div id='" + id + "dialogue' class='dialogue' style='position:fixed;z-index:1001;'></div>").children().last(); 
		           	
		           	// make sure it's hidden
		           	dialogue.css("visibility","hidden");
		           			           						
					// add any links into the page (if applicable)
		           	if (links) dialogue.append(links);		           			           	
		           	
		           	// append the injected html
		           	dialogue.append(bodyHtml);
		           	
					dialogue.children().each( function(i) {
						// thanks to http://viralpatel.net/blogs/jquery-trigger-custom-event-show-hide-element/	
						var el = $.fn["hide"];
						$.fn["hide"] = function () {							
		           			// if we're hiding an immediate child of the dialogue
		           			if (this.parent().is(dialogue)) {
		           				dialogue.prev("div.dialogueCover").remove();
								dialogue.remove();
		           				return false;
		           			} else {
		           				// trigger the regular hide 								
								return el.apply(this, arguments);
							}
						};
					});
							           	
		           	// add any scripts into the page (if applicable)
		           	if (script) dialogue.append(script);
		           			           	
		           	// get a reference to the window for the visible area
		           	var win = $(window);
		           	
		           	// apply the resizing	
	            	$(window).resize(); 
	            	
	            	// this seems to be the best way to avoid the resizing/flicker when showing
	            	window.setTimeout( function() {
	            		// make the dialogue visible
	            		dialogue.css("visibility","visible");
	            		// apply the resizing again (for mobile)	
	            		if (window["_rapidmobile"]) $(window).resize();
	            		// set the focus now that we're visible 
	            		$('[data-focus]').focus();
	            	}, 200);
		           	           	        	            	            	            
		    	}        	       	        	        	        	        		
		    }       	        	        
		});	      
	
	} else {
		window.location = url;
	}
}	        ]]>
	    </actionJavaScript>    	    
    </action> 
</actions>